BOAMP_AVIS_NUM,D_09_01_Rectif_Annonceanterieur,D_09_01_01_Rectif_Annonceanterieur_Reference,D_09_01_01_01_Rectif_Annonceanterieur_Reference_Idweb,D_09_01_01_02_Rectif_Annonceanterieur_Reference_Typeavis,D_09_01_01_02_01_Rectif_Annonceanterieur_Reference_Typeavis_Famille,D_09_01_01_02_01_01_Rectif_Annonceanterieur_Reference_Typeavis_Famille_Mapa,D_09_01_01_02_01_02_Rectif_Annonceanterieur_Reference_Typeavis_Famille_Fns,D_09_01_01_02_01_03_Rectif_Annonceanterieur_Reference_Typeavis_Famille_Joue,D_09_01_01_02_01_04_Rectif_Annonceanterieur_Reference_Typeavis_Famille_Dsp,D_09_01_01_02_01_05_Rectif_Annonceanterieur_Reference_Typeavis_Famille_Divers,D_09_01_01_02_02_Rectif_Annonceanterieur_Reference_Typeavis_Perimetre,D_09_01_01_02_02_01_Rectif_Annonceanterieur_Reference_Typeavis_Perimetre_Cmp2006,D_09_01_01_02_02_02_Rectif_Annonceanterieur_Reference_Typeavis_Perimetre_Cmp2006DEFENSE,D_09_01_01_02_02_03_Rectif_Annonceanterieur_Reference_Typeavis_Perimetre_Directive18,D_09_01_01_02_02_04_Rectif_Annonceanterieur_Reference_Typeavis_Perimetre_Directive17,D_09_01_01_02_02_05_Rectif_Annonceanterieur_Reference_Typeavis_Perimetre_Directive81,D_09_01_01_02_02_06_Rectif_Annonceanterieur_Reference_Typeavis_Perimetre_Directive23,D_09_01_01_02_02_07_Rectif_Annonceanterieur_Reference_Typeavis_Perimetre_Directive24,D_09_01_01_02_02_08_Rectif_Annonceanterieur_Reference_Typeavis_Perimetre_Directive25,D_09_01_01_02_02_09_Rectif_Annonceanterieur_Reference_Typeavis_Perimetre_Dsp,D_09_01_01_02_02_10_Rectif_Annonceanterieur_Reference_Typeavis_Perimetre_Autre,D_09_01_01_02_03_Rectif_Annonceanterieur_Reference_Typeavis_Nature,D_09_01_01_02_03_01_Rectif_Annonceanterieur_Reference_Typeavis_Nature_Preinformation,D_09_01_01_02_03_01_01_Rectif_Annonceanterieur_Reference_Typeavis_Nature_Preinformation_Standard,D_09_01_01_02_03_01_02_Rectif_Annonceanterieur_Reference_Typeavis_Nature_Preinformation_Periodique,D_09_01_01_02_03_01_03_Rectif_Annonceanterieur_Reference_Typeavis_Nature_Preinformation_Qualification,D_09_01_01_02_03_01_04_Rectif_Annonceanterieur_Reference_Typeavis_Nature_Preinformation_Concession,D_09_01_01_02_03_01_05_Rectif_Annonceanterieur_Reference_Typeavis_Nature_Preinformation_Reductiondelai,D_09_01_01_02_03_01_06_Rectif_Annonceanterieur_Reference_Typeavis_Nature_Preinformation_Miseenconcurrence,D_09_01_01_02_03_01_07_Rectif_Annonceanterieur_Reference_Typeavis_Nature_Preinformation_Profilacheteur,D_09_01_01_02_03_02_Rectif_Annonceanterieur_Reference_Typeavis_Nature_Profilacheteur,D_09_01_01_02_03_03_Rectif_Annonceanterieur_Reference_Typeavis_Nature_Appeloffre,D_09_01_01_02_03_03_01_Rectif_Annonceanterieur_Reference_Typeavis_Nature_Appeloffre_Standard,D_09_01_01_02_03_03_02_Rectif_Annonceanterieur_Reference_Typeavis_Nature_Appeloffre_Concours,D_09_01_01_02_03_03_03_Rectif_Annonceanterieur_Reference_Typeavis_Nature_Appeloffre_Periodique,D_09_01_01_02_03_03_04_Rectif_Annonceanterieur_Reference_Typeavis_Nature_Appeloffre_Qualification,D_09_01_01_02_03_03_Rectif_05_Annonceanterieur_Reference_Typeavis_Nature_Appeloffre_Sad,D_09_01_01_02_03_03_06_Rectif_Annonceanterieur_Reference_Typeavis_Nature_Appeloffre_Concession,D_09_01_01_02_03_03_07_Rectif_Annonceanterieur_Reference_Typeavis_Nature_Appeloffre_Concessionnaire,D_09_01_01_02_03_04_Rectif_Annonceanterieur_Reference_Typeavis_Nature_Intentionconclure,D_09_01_01_02_03_05_Rectif_Annonceanterieur_Reference_Typeavis_Nature_Attribution,D_09_01_01_02_03_05_01_Rectif_Annonceanterieur_Reference_Typeavis_Nature_Attribution_Standard,D_09_01_01_02_03_05_02_Rectif_Annonceanterieur_Reference_Typeavis_Nature_Attribution_Concours,D_09_01_01_02_03_05_03_Rectif_Annonceanterieur_Reference_Typeavis_Nature_Attribution_Concession,D_09_01_01_02_03_05_04_Rectif_Annonceanterieur_Reference_Typeavis_Nature_Attribution_Standardinfructueuxsanssuite,D_09_01_01_02_03_06_Rectif_Annonceanterieur_Reference_Typeavis_Nature_Soustraitance,D_09_01_01_02_03_07_Rectif_Annonceanterieur_Reference_Typeavis_Nature_Modification,D_09_01_01_02_03_08_Rectif_Annonceanterieur_Reference_Typeavis_Nature_Qualification,D_09_01_01_02_03_09_Rectif_Annonceanterieur_Reference_Typeavis_Nature_Rectificatif,D_09_01_01_02_03_10_Rectif_Annonceanterieur_Reference_Typeavis_Nature_Periodique,D_09_01_01_02_03_Rectif_11_Annonceanterieur_Reference_Typeavis_Nature_Autre,D_09_01_01_02_04_Rectif_Annonceanterieur_Reference_Typeavis_Statut,D_09_01_01_02_04_01_Rectif_Annonceanterieur_Reference_Typeavis_Statut_Initial,D_09_01_01_02_04_02_Rectif_Annonceanterieur_Reference_Typeavis_Statut_Rectificatif,D_09_01_01_02_04_03_Rectif_Annonceanterieur_Reference_Typeavis_Statut_Annulation,D_09_01_01_02_04_04_Rectif_Annonceanterieur_Reference_Typeavis_Statut_Modification,D_09_01_01_03_Rectif_Annonceanterieur_Reference_Dateenvoi,D_09_01_02_Rectif_Annonceanterieur_Referencepublication,D_09_01_02_01_Rectif_Annonceanterieur_Referencepublication_Publicationpapier,D_09_01_02_02_Rectif_Annonceanterieur_Referencepublication_Publicationelectronique,D_09_01_02_02_01_Rectif_Annonceanterieur_Referencepublication_Publicationelectronique_Datepublication,D_09_01_02_02_02_Rectif_Annonceanterieur_Referencepublication_Publicationelectronique_Datefindiffusion,D_09_01_02_03_Rectif_Annonceanterieur_Referencepublication_Publicationjoue,D_09_01_02_03_01_Rectif_Annonceanterieur_Referencepublication_Publicationjoue_Annee,D_09_01_02_03_02_Rectif_Annonceanterieur_Referencepublication_Publicationjoue_Numparution,D_09_01_02_03_03_Rectif_Annonceanterieur_Referencepublication_Publicationjoue_Numannonce,D_09_01_02_03_04_Rectif_Annonceanterieur_Referencepublication_Publicationjoue_Datepublication,D_09_02_Rectif_Modification,D_09_02_01_Rectif_Modification_Rubinit,D_09_02_02_Rectif_Modification_Lot,D_09_02_03_Rectif_Modification_Apresmention,D_09_02_04_Rectif_Modification_Txtinit,D_09_02_05_Rectif_Modification_Lire,D_09_02_06_Rectif_Modification_Ajouter,D_09_02_07_Rectif_Modification_Supprimer,D_09_02_08_Rectif_Modification_Texte,D_09_02_08_01_Rectif_Modification_Texte_Init,D_09_02_08_02_Rectif_Modification_Texte_Lire,D_09_02_09_Rectif_Modification_Cpv,D_09_02_09_01_Rectif_Modification_Cpv_Init,D_09_02_09_01_01_Rectif_Modification_Cpv_Init_Principal,D_09_02_09_01_02_Rectif_Modification_Cpv_Init_Supplementaire,D_09_02_09_02_Rectif_Modification_Cpv_Lire,D_09_02_09_02_01_Rectif_Modification_Cpv_Lire_Principal,D_09_02_09_02_02_Rectif_Modification_Cpv_Lire_Supplementaire,D_09_02_10_Rectif_Modification_Date,D_09_02_10_01_Rectif_Modification_Date_Init,D_09_02_10_02_Rectif_Modification_Date_Lire,D_09_03_Rectif_Infocomplementaire
15-62548,CF_NIV_SUIV,CF_NIV_SUIV,15-51822,CF_NIV_SUIV,CF_NIV_SUIV,False,False,True,False,False,CF_NIV_SUIV,False,False,True,,False,False,False,False,False,False,CF_NIV_SUIV,CF_NIV_SUIV,False,,,,,False,,,CF_NIV_SUIV,False,False,,,,False,,,CF_NIV_SUIV,,,,,,,,,,,CF_NIV_SUIV,True,,,,,CF_NIV_SUIV,[],CF_NIV_SUIV,2015-04-19 22:00:00,2015-06-08 22:00:00,CF_NIV_SUIV,,,,,CF_NIV_SUIV,Date limite de remise des offres,,,2015-06-09T17:30:00+01:00,2015-06-08T17:30:00+01:00,,,CF_NIV_SUIV,,,CF_NIV_SUIV,CF_NIV_SUIV,None,[],CF_NIV_SUIV,None,[],CF_NIV_SUIV,,,
15-62548,CF_NIV_SUIV,CF_NIV_SUIV,15-51822,CF_NIV_SUIV,CF_NIV_SUIV,False,False,True,False,False,CF_NIV_SUIV,False,False,True,,False,False,False,False,False,False,CF_NIV_SUIV,CF_NIV_SUIV,False,,,,,False,,,CF_NIV_SUIV,False,False,,,,False,,,CF_NIV_SUIV,,,,,,,,,,,CF_NIV_SUIV,True,,,,,CF_NIV_SUIV,[],CF_NIV_SUIV,,,CF_NIV_SUIV,2015.0,78.0,137721.0,2015-04-21 22:00:00,CF_NIV_SUIV,Date limite de remise des offres,,,2015-06-09T17:30:00+01:00,2015-06-08T17:30:00+01:00,,,CF_NIV_SUIV,,,CF_NIV_SUIV,CF_NIV_SUIV,None,[],CF_NIV_SUIV,None,[],CF_NIV_SUIV,,,
15-54860,CF_NIV_SUIV,CF_NIV_SUIV,15-22515,CF_NIV_SUIV,CF_NIV_SUIV,False,False,True,False,False,CF_NIV_SUIV,False,False,True,,False,False,False,False,False,False,CF_NIV_SUIV,CF_NIV_SUIV,False,,,,,False,,,CF_NIV_SUIV,False,False,,,,False,,,CF_NIV_SUIV,,,,,,,,,,,CF_NIV_SUIV,True,,,,,CF_NIV_SUIV,[],CF_NIV_SUIV,2015-03-02 23:00:00,2015-04-12 22:00:00,CF_NIV_SUIV,,,,,CF_NIV_SUIV,IV.3.4) Date limite de réception des offres ou des demandes de participation,,,2015-04-13T17:00:00+01:00,2015-05-21T17:00:00+01:00,,,CF_NIV_SUIV,,,CF_NIV_SUIV,CF_NIV_SUIV,None,[],CF_NIV_SUIV,None,[],CF_NIV_SUIV,,,
15-54860,CF_NIV_SUIV,CF_NIV_SUIV,15-22515,CF_NIV_SUIV,CF_NIV_SUIV,False,False,True,False,False,CF_NIV_SUIV,False,False,True,,False,False,False,False,False,False,CF_NIV_SUIV,CF_NIV_SUIV,False,,,,,False,,,CF_NIV_SUIV,False,False,,,,False,,,CF_NIV_SUIV,,,,,,,,,,,CF_NIV_SUIV,True,,,,,CF_NIV_SUIV,[],CF_NIV_SUIV,2015-03-02 23:00:00,2015-04-12 22:00:00,CF_NIV_SUIV,,,,,CF_NIV_SUIV,VI.3) INFORMATIONS COMPLEMENTAIRES,,,Attention : Date et heure limite de réception des échantillons (...) Lundi 13 avril 2015 à 16h30,Attention : Date et heure limite de réception des échantillons (...) Jeudi 21 mai 2015 à 16h30,,,CF_NIV_SUIV,,,CF_NIV_SUIV,CF_NIV_SUIV,None,[],CF_NIV_SUIV,None,[],CF_NIV_SUIV,,,
15-54860,CF_NIV_SUIV,CF_NIV_SUIV,15-22515,CF_NIV_SUIV,CF_NIV_SUIV,False,False,True,False,False,CF_NIV_SUIV,False,False,True,,False,False,False,False,False,False,CF_NIV_SUIV,CF_NIV_SUIV,False,,,,,False,,,CF_NIV_SUIV,False,False,,,,False,,,CF_NIV_SUIV,,,,,,,,,,,CF_NIV_SUIV,True,,,,,CF_NIV_SUIV,[],CF_NIV_SUIV,,,CF_NIV_SUIV,2015.0,46.0,78559.0,2015-03-05 23:00:00,CF_NIV_SUIV,IV.3.4) Date limite de réception des offres ou des demandes de participation,,,2015-04-13T17:00:00+01:00,2015-05-21T17:00:00+01:00,,,CF_NIV_SUIV,,,CF_NIV_SUIV,CF_NIV_SUIV,None,[],CF_NIV_SUIV,None,[],CF_NIV_SUIV,,,
15-54860,CF_NIV_SUIV,CF_NIV_SUIV,15-22515,CF_NIV_SUIV,CF_NIV_SUIV,False,False,True,False,False,CF_NIV_SUIV,False,False,True,,False,False,False,False,False,False,CF_NIV_SUIV,CF_NIV_SUIV,False,,,,,False,,,CF_NIV_SUIV,False,False,,,,False,,,CF_NIV_SUIV,,,,,,,,,,,CF_NIV_SUIV,True,,,,,CF_NIV_SUIV,[],CF_NIV_SUIV,,,CF_NIV_SUIV,2015.0,46.0,78559.0,2015-03-05 23:00:00,CF_NIV_SUIV,VI.3) INFORMATIONS COMPLEMENTAIRES,,,Attention : Date et heure limite de réception des échantillons (...) Lundi 13 avril 2015 à 16h30,Attention : Date et heure limite de réception des échantillons (...) Jeudi 21 mai 2015 à 16h30,,,CF_NIV_SUIV,,,CF_NIV_SUIV,CF_NIV_SUIV,None,[],CF_NIV_SUIV,None,[],CF_NIV_SUIV,,,
15-66226,CF_NIV_SUIV,CF_NIV_SUIV,15-55357,CF_NIV_SUIV,CF_NIV_SUIV,False,False,True,False,False,CF_NIV_SUIV,False,False,True,,False,False,False,False,False,False,CF_NIV_SUIV,CF_NIV_SUIV,False,,,,,False,,,CF_NIV_SUIV,False,False,,,,False,,,CF_NIV_SUIV,,,,,,,,,,,CF_NIV_SUIV,True,,,,,CF_NIV_SUIV,[],CF_NIV_SUIV,2015-04-12 22:00:00,2015-05-17 22:00:00,CF_NIV_SUIV,,,,,CF_NIV_SUIV,IV.3.4 Date limite de réception des offres ou des demandes de participation,,,2015-05-18T11:30:00+01:00,2015-06-02T11:30:00+01:00,,,CF_NIV_SUIV,,,CF_NIV_SUIV,CF_NIV_SUIV,None,[],CF_NIV_SUIV,None,[],CF_NIV_SUIV,,,
15-66226,CF_NIV_SUIV,CF_NIV_SUIV,15-55357,CF_NIV_SUIV,CF_NIV_SUIV,False,False,True,False,False,CF_NIV_SUIV,False,False,True,,False,False,False,False,False,False,CF_NIV_SUIV,CF_NIV_SUIV,False,,,,,False,,,CF_NIV_SUIV,False,False,,,,False,,,CF_NIV_SUIV,,,,,,,,,,,CF_NIV_SUIV,True,,,,,CF_NIV_SUIV,[],CF_NIV_SUIV,,,CF_NIV_SUIV,2015.0,73.0,129517.0,2015-04-14 22:00:00,CF_NIV_SUIV,IV.3.4 Date limite de réception des offres ou des demandes de participation,,,2015-05-18T11:30:00+01:00,2015-06-02T11:30:00+01:00,,,CF_NIV_SUIV,,,CF_NIV_SUIV,CF_NIV_SUIV,None,[],CF_NIV_SUIV,None,[],CF_NIV_SUIV,,,
15-67939,CF_NIV_SUIV,CF_NIV_SUIV,15-63887,CF_NIV_SUIV,CF_NIV_SUIV,False,True,False,False,False,CF_NIV_SUIV,True,False,False,,False,False,False,False,False,False,CF_NIV_SUIV,CF_NIV_SUIV,False,,,,,False,,,CF_NIV_SUIV,False,False,,,,False,,,CF_NIV_SUIV,,,,,,,,,,,CF_NIV_SUIV,True,,,,,CF_NIV_SUIV,[],CF_NIV_SUIV,2015-04-26 22:00:00,2015-05-18 22:00:00,CF_NIV_SUIV,,,,,CF_NIV_SUIV,DCE 2 suite à additif/modification concernant des travaux en chaufferie centrale du bâtiment B et la mise en oeuvre de panneaux photovoltaïque,,,,,"En complément du DCE 1 mise en ligne le 24/04/15, un DCE 2 ERRATUM/ADDITIF est disponible. il prend en compte l'additif/modification concernant des travaux en chaufferie centrale du bâtiment B et la mise en oeuvre de panneaux photovoltaïque. Cette modification porte sur les lots :-Lot 5 PLATRERIE - PLAFONDS-Lot 9 ELECTRICITE COURANTS FORTS COURANTS FAIBLES ET SECURITE-Lot 10 CHAUFFAGE- PLOMBERIE-VENTILATIONLe dossier de consultation est modifié comme suit :ADDITIFS :-Le C.C.T.P PRO EXE erratum et additif lot 5- Plâtrerie-plafonds du 30/04/15-Additif CCTP lot 9 électricité courants forts courants faibles et sécurité -Additif CCTP lot10 Chauffage plomberie ventilation-Le DPGF lot 9- électricité courant fort courant faible -Le DPGF lot10- chauffage-plomberie -Plans INGEPOLE - PRO plans Electicité ind A additifANNULE ET REMPLACE :-PRO plan masse-PRO plan RDCL'ensemble des documents ont été mise en ligne, ils sont téléchargeables gratuitement sur le site internet : http://www.achats-limousin.com",,CF_NIV_SUIV,,,CF_NIV_SUIV,CF_NIV_SUIV,None,[],CF_NIV_SUIV,None,[],CF_NIV_SUIV,,,
15-68149,CF_NIV_SUIV,CF_NIV_SUIV,15-47705,CF_NIV_SUIV,CF_NIV_SUIV,False,False,True,False,False,CF_NIV_SUIV,False,False,True,,False,False,False,False,False,False,CF_NIV_SUIV,CF_NIV_SUIV,False,,,,,False,,,CF_NIV_SUIV,False,False,,,,False,,,CF_NIV_SUIV,,,,,,,,,,,CF_NIV_SUIV,True,,,,,CF_NIV_SUIV,[],CF_NIV_SUIV,2015-03-29 22:00:00,2015-05-06 22:00:00,CF_NIV_SUIV,,,,,CF_NIV_SUIV,Date limite de réception des offres,,,2015-05-07T16:00:00+01:00,2015-05-18T16:00:00+01:00,,,CF_NIV_SUIV,,,CF_NIV_SUIV,CF_NIV_SUIV,None,[],CF_NIV_SUIV,None,[],CF_NIV_SUIV,,,
15-68149,CF_NIV_SUIV,CF_NIV_SUIV,15-47705,CF_NIV_SUIV,CF_NIV_SUIV,False,False,True,False,False,CF_NIV_SUIV,False,False,True,,False,False,False,False,False,False,CF_NIV_SUIV,CF_NIV_SUIV,False,,,,,False,,,CF_NIV_SUIV,False,False,,,,False,,,CF_NIV_SUIV,,,,,,,,,,,CF_NIV_SUIV,True,,,,,CF_NIV_SUIV,[],CF_NIV_SUIV,2015-03-29 22:00:00,2015-05-06 22:00:00,CF_NIV_SUIV,,,,,CF_NIV_SUIV,Information sur les lots,,,"Lot no 1Description succincte : Prestations de transport sanitaire intra hospitalier et inter-établissement provisoire (moins de 48H) des adultes, des enfants et des patients atteints d'obésité (hors SMUR et TIIH)","Lot no 1Description succincte : Prestations de transport sanitaire intra hospitalier et inter-établissement provisoire (moins de 48H) des adultes, des enfants et des patients atteints d'obésité et de transport sanitaire intra hospitalier et inter-établissement provisoire et définitif des patients détenus de l'Unité Hospitalière Sécurisée Interrégionale (hors SMUR et TIIH)",,,CF_NIV_SUIV,,,CF_NIV_SUIV,CF_NIV_SUIV,None,[],CF_NIV_SUIV,None,[],CF_NIV_SUIV,,,
15-68149,CF_NIV_SUIV,CF_NIV_SUIV,15-47705,CF_NIV_SUIV,CF_NIV_SUIV,False,False,True,False,False,CF_NIV_SUIV,False,False,True,,False,False,False,False,False,False,CF_NIV_SUIV,CF_NIV_SUIV,False,,,,,False,,,CF_NIV_SUIV,False,False,,,,False,,,CF_NIV_SUIV,,,,,,,,,,,CF_NIV_SUIV,True,,,,,CF_NIV_SUIV,[],CF_NIV_SUIV,,,CF_NIV_SUIV,2015.0,64.0,113169.0,2015-03-31 22:00:00,CF_NIV_SUIV,Date limite de réception des offres,,,2015-05-07T16:00:00+01:00,2015-05-18T16:00:00+01:00,,,CF_NIV_SUIV,,,CF_NIV_SUIV,CF_NIV_SUIV,None,[],CF_NIV_SUIV,None,[],CF_NIV_SUIV,,,
15-68149,CF_NIV_SUIV,CF_NIV_SUIV,15-47705,CF_NIV_SUIV,CF_NIV_SUIV,False,False,True,False,False,CF_NIV_SUIV,False,False,True,,False,False,False,False,False,False,CF_NIV_SUIV,CF_NIV_SUIV,False,,,,,False,,,CF_NIV_SUIV,False,False,,,,False,,,CF_NIV_SUIV,,,,,,,,,,,CF_NIV_SUIV,True,,,,,CF_NIV_SUIV,[],CF_NIV_SUIV,,,CF_NIV_SUIV,2015.0,64.0,113169.0,2015-03-31 22:00:00,CF_NIV_SUIV,Information sur les lots,,,"Lot no 1Description succincte : Prestations de transport sanitaire intra hospitalier et inter-établissement provisoire (moins de 48H) des adultes, des enfants et des patients atteints d'obésité (hors SMUR et TIIH)","Lot no 1Description succincte : Prestations de transport sanitaire intra hospitalier et inter-établissement provisoire (moins de 48H) des adultes, des enfants et des patients atteints d'obésité et de transport sanitaire intra hospitalier et inter-établissement provisoire et définitif des patients détenus de l'Unité Hospitalière Sécurisée Interrégionale (hors SMUR et TIIH)",,,CF_NIV_SUIV,,,CF_NIV_SUIV,CF_NIV_SUIV,None,[],CF_NIV_SUIV,None,[],CF_NIV_SUIV,,,
15-68174,CF_NIV_SUIV,CF_NIV_SUIV,15-64433,CF_NIV_SUIV,CF_NIV_SUIV,False,True,False,False,False,CF_NIV_SUIV,True,False,False,,False,False,False,False,False,False,CF_NIV_SUIV,CF_NIV_SUIV,False,,,,,False,,,CF_NIV_SUIV,False,False,,,,False,,,CF_NIV_SUIV,,,,,,,,,,,CF_NIV_SUIV,True,,,,,CF_NIV_SUIV,[],CF_NIV_SUIV,2015-04-26 22:00:00,2015-05-10 22:00:00,CF_NIV_SUIV,,,,,CF_NIV_SUIV,Caractéristiques principales,,,Refus des variantes.,Les candidats doivent présenter une offre de base du marché proposant des serveurs Xeon E5 v2 répondant à l'intégralité des caractéristiques minima exigées sur chaque type de serveur décrit à l'article 2 de l'A.E.-C.C.P. Les variantes sont autorisées. Les candidats ont la possibilité de présenter une variante portant sur la présentation de serveurs Xeon E5 v3 et répondant à l'intégralité des caractéristiques minima exigées sur chaque type de serveur décrit à l'article 4 de l'A.E.-C.C.P.,,,CF_NIV_SUIV,,,CF_NIV_SUIV,CF_NIV_SUIV,None,[],CF_NIV_SUIV,None,[],CF_NIV_SUIV,,,
15-68174,CF_NIV_SUIV,CF_NIV_SUIV,15-64433,CF_NIV_SUIV,CF_NIV_SUIV,False,True,False,False,False,CF_NIV_SUIV,True,False,False,,False,False,False,False,False,False,CF_NIV_SUIV,CF_NIV_SUIV,False,,,,,False,,,CF_NIV_SUIV,False,False,,,,False,,,CF_NIV_SUIV,,,,,,,,,,,CF_NIV_SUIV,True,,,,,CF_NIV_SUIV,[],CF_NIV_SUIV,2015-04-26 22:00:00,2015-05-10 22:00:00,CF_NIV_SUIV,,,,,CF_NIV_SUIV,Caractéristiques principales,,,Il s'agit d'acquérir et de faire réaliser la maintenance avec garantie de temps d'intervention et/ou de rétablissement de 11 serveurs répondant aux spécifications techniques décrites dans l'acte d'engagement-cahier des clauses particulières.,Il s'agit d'acquérir et de faire réaliser la maintenance avec garantie de temps d'intervention et/ou de rétablissement de serveurs répondant aux spécifications techniques suivantes décrites dans l'acte d'engagement-cahier des clauses particulières.,,,CF_NIV_SUIV,,,CF_NIV_SUIV,CF_NIV_SUIV,None,[],CF_NIV_SUIV,None,[],CF_NIV_SUIV,,,
15-68174,CF_NIV_SUIV,CF_NIV_SUIV,15-64433,CF_NIV_SUIV,CF_NIV_SUIV,False,True,False,False,False,CF_NIV_SUIV,True,False,False,,False,False,False,False,False,False,CF_NIV_SUIV,CF_NIV_SUIV,False,,,,,False,,,CF_NIV_SUIV,False,False,,,,False,,,CF_NIV_SUIV,,,,,,,,,,,CF_NIV_SUIV,True,,,,,CF_NIV_SUIV,[],CF_NIV_SUIV,2015-04-26 22:00:00,2015-05-10 22:00:00,CF_NIV_SUIV,,,,,CF_NIV_SUIV,Critères d'attribution,,,"Offre économiquement la plus avantageuse appréciée en fonction des critères énoncés ci-dessous avec leur pondération. - critère technique : valeur technique, décomposé ainsi : a. garantie de temps d'intervention proposée : 15 points b. garantie de temps de résolution proposée : 15 points c. qualité technique des produits : 15 points d. homogénéité des produits : 5 points e. date de mise à disposition du service : 50 points : 40 %; - critère financier (noté sur 60 %) : prix : 60 %.","Le jugement des offres de base et des variantes sera effectué séparément selon les critères suivants par attribution d'une note à concurrence du nombre de points maximum par critère figurant ci-après :1. Critère technique (noté sur 40 %) : valeur technique, décomposé ainsi :a. Garantie de Temps d'Intervention proposée : 15 pointsb. Garantie de Temps de Résolution proposée : 15 pointsc. Qualité technique des produits : 15 pointsd. Homogénéité des produits : 5 pointse. Date de mise à disposition du service : 50 points2. Critère financier (noté sur 60 %) : prix (sur la base du Scénario-type de consommation).",,,CF_NIV_SUIV,,,CF_NIV_SUIV,CF_NIV_SUIV,None,[],CF_NIV_SUIV,None,[],CF_NIV_SUIV,,,
15-68184,CF_NIV_SUIV,CF_NIV_SUIV,15-66138,CF_NIV_SUIV,CF_NIV_SUIV,False,True,False,False,False,CF_NIV_SUIV,True,False,False,,False,False,False,False,False,False,CF_NIV_SUIV,CF_NIV_SUIV,False,,,,,False,,,CF_NIV_SUIV,False,False,,,,False,,,CF_NIV_SUIV,,,,,,,,,,,CF_NIV_SUIV,True,,,,,CF_NIV_SUIV,[],CF_NIV_SUIV,2015-04-28 22:00:00,2015-05-18 22:00:00,CF_NIV_SUIV,,,,,CF_NIV_SUIV,,,,Objet du marché : Réfection de la couverture du Clos Fleuri,Objet du marché : Ecole du Centre - Travaux de rénovation,,,CF_NIV_SUIV,,,CF_NIV_SUIV,CF_NIV_SUIV,None,[],CF_NIV_SUIV,None,[],CF_NIV_SUIV,,,
15-68184,CF_NIV_SUIV,CF_NIV_SUIV,15-66138,CF_NIV_SUIV,CF_NIV_SUIV,False,True,False,False,False,CF_NIV_SUIV,True,False,False,,False,False,False,False,False,False,CF_NIV_SUIV,CF_NIV_SUIV,False,,,,,False,,,CF_NIV_SUIV,False,False,,,,False,,,CF_NIV_SUIV,,,,,,,,,,,CF_NIV_SUIV,True,,,,,CF_NIV_SUIV,[],CF_NIV_SUIV,2015-04-28 22:00:00,2015-05-18 22:00:00,CF_NIV_SUIV,,,,,CF_NIV_SUIV,,,,Lieu d'exécution des travaux : 146 rue Jean Jaurès,Lieu d'exécution des travaux : 5 rue Roger Salengro,,,CF_NIV_SUIV,,,CF_NIV_SUIV,CF_NIV_SUIV,None,[],CF_NIV_SUIV,None,[],CF_NIV_SUIV,,,
15-68224,CF_NIV_SUIV,CF_NIV_SUIV,15-36722,CF_NIV_SUIV,CF_NIV_SUIV,False,False,True,False,False,CF_NIV_SUIV,False,False,True,,False,False,False,False,False,False,CF_NIV_SUIV,CF_NIV_SUIV,False,,,,,False,,,CF_NIV_SUIV,False,False,,,,False,,,CF_NIV_SUIV,,,,,,,,,,,CF_NIV_SUIV,True,,,,,CF_NIV_SUIV,[],CF_NIV_SUIV,2015-03-10 23:00:00,2015-05-03 22:00:00,CF_NIV_SUIV,,,,,CF_NIV_SUIV,Date limite de réception des offres,,,2015-05-04T12:00:00+01:00,2015-05-06T12:00:00+01:00,,,CF_NIV_SUIV,,,CF_NIV_SUIV,CF_NIV_SUIV,None,[],CF_NIV_SUIV,None,[],CF_NIV_SUIV,,,
15-68224,CF_NIV_SUIV,CF_NIV_SUIV,15-36722,CF_NIV_SUIV,CF_NIV_SUIV,False,False,True,False,False,CF_NIV_SUIV,False,False,True,,False,False,False,False,False,False,CF_NIV_SUIV,CF_NIV_SUIV,False,,,,,False,,,CF_NIV_SUIV,False,False,,,,False,,,CF_NIV_SUIV,,,,,,,,,,,CF_NIV_SUIV,True,,,,,CF_NIV_SUIV,[],CF_NIV_SUIV,,,CF_NIV_SUIV,2015.0,52.0,90226.0,2015-03-13 23:00:00,CF_NIV_SUIV,Date limite de réception des offres,,,2015-05-04T12:00:00+01:00,2015-05-06T12:00:00+01:00,,,CF_NIV_SUIV,,,CF_NIV_SUIV,CF_NIV_SUIV,None,[],CF_NIV_SUIV,None,[],CF_NIV_SUIV,,,
15-68235,CF_NIV_SUIV,CF_NIV_SUIV,15-57364,CF_NIV_SUIV,CF_NIV_SUIV,False,True,False,False,False,CF_NIV_SUIV,True,False,False,,False,False,False,False,False,False,CF_NIV_SUIV,CF_NIV_SUIV,False,,,,,False,,,CF_NIV_SUIV,False,False,,,,False,,,CF_NIV_SUIV,,,,,,,,,,,CF_NIV_SUIV,True,,,,,CF_NIV_SUIV,[],CF_NIV_SUIV,2015-04-16 22:00:00,2015-05-10 22:00:00,CF_NIV_SUIV,,,,,CF_NIV_SUIV,autres renseignements,,"<?xml version=""1.0"" encoding=""UTF-16""?>
<APRES_MENTION xmlns:xsi=""http://www.w3.org/2001/XMLSchema-instance"">numéro de référence attribué au marché par le pouvoir adjudicateur/l'entité adjudicatrice</APRES_MENTION>",016FR2015,015FR2015,,,CF_NIV_SUIV,,,CF_NIV_SUIV,CF_NIV_SUIV,None,[],CF_NIV_SUIV,None,[],CF_NIV_SUIV,,,
15-68239,CF_NIV_SUIV,CF_NIV_SUIV,15-57074,CF_NIV_SUIV,CF_NIV_SUIV,False,True,False,False,False,CF_NIV_SUIV,True,False,False,,False,False,False,False,False,False,CF_NIV_SUIV,CF_NIV_SUIV,False,,,,,False,,,CF_NIV_SUIV,False,False,,,,False,,,CF_NIV_SUIV,,,,,,,,,,,CF_NIV_SUIV,True,,,,,CF_NIV_SUIV,[],CF_NIV_SUIV,2015-04-14 22:00:00,2015-05-05 22:00:00,CF_NIV_SUIV,,,,,CF_NIV_SUIV,Article 7 du Réglement de Consultation - ajout d'une plage de visite,,,"Une visite des lieux est obligatoire pour les lots 1', 5, 6 et 8, avant de remettre une offre (sous peine d'irrecevabilité). Les visites sont planifiées les jours suivants :-Jeudi 23 avril à 15h30-Jeudi 30 avril à 15h30",,-Mercredi 6 mai à 15h30,,CF_NIV_SUIV,,,CF_NIV_SUIV,CF_NIV_SUIV,None,[],CF_NIV_SUIV,None,[],CF_NIV_SUIV,,,
15-68239,CF_NIV_SUIV,CF_NIV_SUIV,15-57074,CF_NIV_SUIV,CF_NIV_SUIV,False,True,False,False,False,CF_NIV_SUIV,True,False,False,,False,False,False,False,False,False,CF_NIV_SUIV,CF_NIV_SUIV,False,,,,,False,,,CF_NIV_SUIV,False,False,,,,False,,,CF_NIV_SUIV,,,,,,,,,,,CF_NIV_SUIV,True,,,,,CF_NIV_SUIV,[],CF_NIV_SUIV,2015-04-14 22:00:00,2015-05-05 22:00:00,CF_NIV_SUIV,,,,,CF_NIV_SUIV,Date limite de réception des offres,,,2015-05-06T16:00:00+01:00,2015-05-11T16:00:00+01:00,,,CF_NIV_SUIV,,,CF_NIV_SUIV,CF_NIV_SUIV,None,[],CF_NIV_SUIV,None,[],CF_NIV_SUIV,,,
15-68240,CF_NIV_SUIV,CF_NIV_SUIV,15-67951,CF_NIV_SUIV,CF_NIV_SUIV,False,False,True,False,False,CF_NIV_SUIV,False,False,True,,False,False,False,False,False,False,CF_NIV_SUIV,CF_NIV_SUIV,False,,,,,False,,,CF_NIV_SUIV,False,False,,,,False,,,CF_NIV_SUIV,,,,,,,,,,,CF_NIV_SUIV,True,,,,,CF_NIV_SUIV,[],CF_NIV_SUIV,2015-04-29 22:00:00,2015-06-09 22:00:00,CF_NIV_SUIV,,,,,CF_NIV_SUIV,II.2.1)Quantité ou étendue globale :,,,,,Quantité ou étendue globale :A titre indicatif la quantité ou étendue globale annuel du marché pour chacun des lots est la suivante :-Lot 1 : Etanchéité = 75 000 euro HT / an-Lot 2 : Plomberie - Couverture = 40 000 euro HT /an-Lot 3 : Electricité = 105 000 euro HT / an-Lot 4 : Gros-oeuvre - Maçonnerie - Plâtrerie - Carrelage - Faïence - Faux-plafonds = 85 000 euro HT / an-Lot 5 : Menuiserie - Quincaillerie = 105 000 euro HT / an-Lot 6 : Serrurerie - Métallerie = 50 000 euro HT / an-Lot 7 : Peinture = 70 000 euro HT / an-Lot 8 : Sol = 20 000 euro HT / an-Lot 9 : Vitrerie = 15 000 euro HT / an-Lot 10 : Store = 10 000 euro HT / an-Lot 11 : Assainissement = 30 000 euro HT / an-Lot 12 : Clôture = 35 000 euro HT / an,,CF_NIV_SUIV,,,CF_NIV_SUIV,CF_NIV_SUIV,None,[],CF_NIV_SUIV,None,[],CF_NIV_SUIV,,,
