BOAMP_AVIS_NUM,D_14_01_Conditionparticipationsystmequalif_Conditions,D_14_02_Conditionparticipationsystmequalif_Methodeverification
15-155385,conforme au règlement de consultation,
15-152525,Avoir déjà rempli ces services auprès d'autres collectivités locales depuis au moins trois ans,
15-155729,Remplir déjà ce service auprès d'autres collectivités locales depuis au moins trois ans,
15-158917,Renseignements et formalités prévus aux articles 43 à 46 du code des marchés publics et précisés dans le règlement de la consultation. Capacité technique : justificatifs demandés.,
15-166639,En application de l'article 46 le marché ne peut être attribué au candidat retenu que sous réserve que celui-ci soit en mesure de produire les certificats fiscaux et sociaux délivrés par les administrations et organismes compétents.,"1° / Valeur technique : 60 % Déclinaison de la valeur technique : 30 % Réactivité en cas d'urgence ; 30 % Critère environnemental, la proximité.2° / Prix de l'offre : 40 %"
